{
  "$schema":"https://json-schema.org/draft/2020-12/schema","type":"object","required":["schema_version","contract_id","contract_version","run_id","case_id","stage","attempt","idempotency_key","status","started_at","completed_at","inputs","outputs","result","decisions","warnings","errors","retryable","tool_calls","runtime","publishing_enabled","real_production_enabled"],"properties":{
    "schema_version":{"type":"string","enum":["1.0"]},"contract_id":{"type":"string","enum":["cold-truth.editor"]},"contract_version":{"type":"string","enum":["1.0.0-c3-fixture"]},"run_id":{"type":"string","enum":["phase-c3-editor-fixture"]},"case_id":{"type":"string","enum":["glass-river-writing-fixture"]},"stage":{"type":"string","enum":["editor_fixture"]},"attempt":{"type":"integer","enum":[1]},"idempotency_key":{"type":"string","pattern":"^[a-f0-9]{64}$"},"status":{"type":"string","enum":["success"]},"started_at":{"type":"string","enum":["2026-07-12T00:00:00Z"]},"completed_at":{"type":"string","enum":["2026-07-12T00:00:00Z"]},
    "inputs":{"type":"array","items":{"type":"object","required":["name","type","kind","path","sha256","size_bytes"],"properties":{"name":{"type":"string"},"type":{"type":"string"},"kind":{"type":"string","enum":["file"]},"path":{"type":"string"},"sha256":{"type":"string"},"size_bytes":{"type":"integer"}},"additionalProperties":false}},"outputs":{"type":"array","items":{"type":"object","required":[],"properties":{},"additionalProperties":false}},
    "result":{"type":"object","required":["upstream_writer_handoff_hash","approved_seen_1","approved_seen_2","approved_seen_3","excluded_absent_1","excluded_absent_2","excluded_absent_3","factual_attribution_check","unsupported_material_check","redundancy_check","redundancy_findings","narrative_coherence_check","editor_decision","simulated_human_checkpoint_required","handoff_to_human_review","later_stage_requested","artifact_hashes","external_research_used","browser_used","mcp_used","network_used"],"properties":{
      "upstream_writer_handoff_hash":{"type":"string","pattern":"^[a-f0-9]{64}$"},"approved_seen_1":{"type":"string","enum":["SYN-RV-01"]},"approved_seen_2":{"type":"string","enum":["SYN-RV-02"]},"approved_seen_3":{"type":"string","enum":["SYN-RV-03"]},"excluded_absent_1":{"type":"string","enum":["SYN-RV-X1"]},"excluded_absent_2":{"type":"string","enum":["SYN-RV-X2"]},"excluded_absent_3":{"type":"string","enum":["SYN-RV-X3"]},"factual_attribution_check":{"type":"string","enum":["passed"]},"unsupported_material_check":{"type":"string","enum":["passed"]},"redundancy_check":{"type":"string","enum":["passed"]},"redundancy_findings":{"type":"array","items":{"type":"string"}},"narrative_coherence_check":{"type":"string","enum":["passed"]},"editor_decision":{"type":"string","enum":["ready_for_human_script_review"]},"simulated_human_checkpoint_required":{"type":"boolean","enum":[true]},"handoff_to_human_review":{"type":"boolean","enum":[true]},"later_stage_requested":{"type":"boolean","enum":[false]},"artifact_hashes":{"type":"object","required":[],"properties":{},"additionalProperties":false},"external_research_used":{"type":"boolean","enum":[false]},"browser_used":{"type":"boolean","enum":[false]},"mcp_used":{"type":"boolean","enum":[false]},"network_used":{"type":"boolean","enum":[false]}
    },"additionalProperties":false},
    "decisions":{"type":"array","items":{"type":"object","required":["rule","result"],"properties":{"rule":{"type":"string","enum":["simulated_human_checkpoint"]},"result":{"type":"string","enum":["required"]}},"additionalProperties":false}},"warnings":{"type":"array","items":{"type":"string"}},"errors":{"type":"array","items":{"type":"string"}},"retryable":{"type":"boolean","enum":[false]},"tool_calls":{"type":"array","items":{"type":"object","required":[],"properties":{},"additionalProperties":false}},"runtime":{"type":"object","required":["provider","runtime","model","version"],"properties":{"provider":{"type":"string"},"runtime":{"type":"string"},"model":{"type":"string"},"version":{"type":"string"}},"additionalProperties":false},"publishing_enabled":{"type":"boolean","enum":[false]},"real_production_enabled":{"type":"boolean","enum":[false]}
  },"additionalProperties":false
}
