{
  "schema_version": "1.0",
  "contract_id": "cold-truth.editor",
  "contract_version": "1.0.0-c3-fixture",
  "run_id": "phase-c3-editor-fixture",
  "case_id": "glass-river-writing-fixture",
  "stage": "editor_fixture",
  "attempt": 1,
  "idempotency_key": "166a572a97687b712d089b5e62e3e60a04413a1b83b4cb939548fa62d4d8838c",
  "status": "success",
  "started_at": "2026-07-12T00:00:00Z",
  "completed_at": "2026-07-12T00:00:00Z",
  "inputs": [
    {
      "name": "synthetic_editor_boundaries",
      "type": "synthetic_editor_boundaries",
      "kind": "file",
      "path": "C:\\Youtube Automation Obsidian\\automation\\fixtures\\real_writer_editor_fixture_workspace\\synthetic_editor_boundaries.json",
      "sha256": "fe7e6e3f7f4d74d5041f49e79b995c46dbd2d3757816905caf033971846c1e89",
      "size_bytes": 640
    },
    {
      "name": "synthetic_writer_handoff",
      "type": "writer_fixture_handoff",
      "kind": "file",
      "path": "C:\\Youtube Automation Obsidian\\automation\\fixtures\\real_writer_editor_fixture_workspace\\output\\c3_real_writer_editor_chain\\writer\\agent_runs\\04948410dca1bb01a98a4cf02410d7e9d959885b98f004c2d602925b5f33274c\\attempt-001\\output\\strategist_handoff.json",
      "sha256": "fa74fa01838651b8e893159c1c689e443588a3b3cfb2db553aae1f27506db1fb",
      "size_bytes": 3663
    }
  ],
  "outputs": [],
  "result": {
    "upstream_writer_handoff_hash": "fa74fa01838651b8e893159c1c689e443588a3b3cfb2db553aae1f27506db1fb",
    "approved_seen_1": "SYN-RV-01",
    "approved_seen_2": "SYN-RV-02",
    "approved_seen_3": "SYN-RV-03",
    "excluded_absent_1": "SYN-RV-X1",
    "excluded_absent_2": "SYN-RV-X2",
    "excluded_absent_3": "SYN-RV-X3",
    "factual_attribution_check": "passed",
    "unsupported_material_check": "passed",
    "redundancy_check": "passed",
    "redundancy_findings": [],
    "narrative_coherence_check": "passed",
    "editor_decision": "ready_for_human_script_review",
    "simulated_human_checkpoint_required": true,
    "handoff_to_human_review": true,
    "later_stage_requested": false,
    "artifact_hashes": {},
    "external_research_used": false,
    "browser_used": false,
    "mcp_used": false,
    "network_used": false
  },
  "decisions": [
    {
      "rule": "simulated_human_checkpoint",
      "result": "required"
    }
  ],
  "warnings": [],
  "errors": [],
  "retryable": false,
  "tool_calls": [],
  "runtime": {
    "provider": "codex-exec",
    "runtime": "controlled-real-fixture",
    "model": "not-reported",
    "version": "not-reported"
  },
  "publishing_enabled": false,
  "real_production_enabled": false
}
